route_cluster_id,route_cluster_name_en,route_cluster_name_es,base_tour_type,recommended_start_time,typical_duration_hours,walking_level,road_access,primary_habitats,default_pricing_complexity,notes_en,notes_es,active
mindo_town,Mindo Town and Nearby Gardens,Pueblo de Mindo y Jardines Cercanos,half_day,6:00,3-4,easy,easy,"gardens, edges, secondary forest",standard,"Good for accessible birds, hummingbirds, tanagers, and shorter visits.","Bueno para aves accesibles, colibríes, tangaras y visitas cortas.",TRUE
rio_nambillo,Río Nambillo and Forest Trails,Río Nambillo y Senderos de Bosque,full_day,5:30,6-8,moderate,moderate,"cloud forest, riparian forest",standard_plus,Useful route cluster for early bird activity and forest species.,Ruta útil para actividad temprana y especies de bosque.,TRUE
san_lorenzo,San Lorenzo Route,Ruta San Lorenzo,full_day,5:00,7-9,moderate,moderate,"cloud forest, foothill forest",premium,Good candidate route for target-heavy custom birding.,Buena ruta candidata para tours personalizados con especies objetivo.,TRUE
tandayapa_bellavista,Tandayapa and Bellavista Corridor,Corredor Tandayapa y Bellavista,custom_private,4:30,8-10,moderate,moderate,"cloud forest, montane forest",premium,Useful for broader Chocó-Andean target itineraries.,Útil para itinerarios de especies objetivo en el Chocó Andino.,TRUE
paz_de_las_aves,Paz de las Aves Area,Zona Paz de las Aves,custom_private,4:30,8-10,moderate,moderate,"cloud forest, antpitta feeding sites, lek areas",premium,Special access and early planning may be required.,Puede requerir acceso especial y planificación temprana.,TRUE
milpe_silanche,Milpe and Silanche Lowland Route,Ruta Milpe y Silanche,custom_private,4:30,9-11,moderate,long_drive,"foothill forest, lower elevation Chocó forest",premium_plus,Better for specialized lowland or foothill targets outside standard Mindo routes.,Mejor para objetivos especializados de tierras bajas o estribaciones fuera de rutas estándar de Mindo.,TRUE
mashpi_road,Mashpi Road,Ruta Mashpi,custom_private,4:30,9-11,moderate,long_drive,"Chocó forest, foothill forest",premium_plus,Use for high-value custom targets and extended birding days.,Úsala para especies objetivo de alto valor y jornadas extendidas.,TRUE